Dlg_no,Greeting,Introduction,Manager's name,Company's name,Say goodbye,The requirement
0,Алло здравствуйте,Меня зовут ангелина компания диджитал бизнес звоним вам по поводу продления лицензии а мы с серым у вас скоро срок заканчивается,ангелина,диджитал бизнес,Всего хорошего до свидания,True
1,Алло здравствуйте,Меня зовут ангелина компания диджитал бизнес звоню вам по поводу продления а мы сели обратила внимание что у вас срок заканчивается,ангелина,диджитал бизнес,До свидания,True
2,Алло здравствуйте,Меня зовут ангелина компания диджитал бизнес звоню вам по поводу продления лицензии а мастера мы с вами сотрудничали по видео там,ангелина,диджитал бизнес,Все хорошо,True
3,Добрый меня максим зовут компания китобизнес удобно говорить,Добрый меня максим зовут компания китобизнес удобно говорить,максим,китобизнес,Угу все хорошо да понедельника тогда всего доброго,True
4,,,,,Во вторник все ну с вами да тогда до вторника до свидания,False
5,,Да это анастасия,анастасия,,Ну до свидания хорошего вечера,False
